{
  "dataset": "TE64",
  "elapsed_seconds": 0.594,
  "flagged_pairs": [
    {
      "aligned_length": 212,
      "caid3_id": "DP03995",
      "identity": 0.49528,
      "matches": 105,
      "query_id": "DP02570",
      "score": 515,
      "shorter_sequence_coverage_proxy": 0.98148
    },
    {
      "aligned_length": 54,
      "caid3_id": "DP04198",
      "identity": 0.38889,
      "matches": 21,
      "query_id": "DP02529",
      "score": 57,
      "shorter_sequence_coverage_proxy": 0.0966
    },
    {
      "aligned_length": 54,
      "caid3_id": "DP04144",
      "identity": 0.37037,
      "matches": 20,
      "query_id": "DP02787",
      "score": 50,
      "shorter_sequence_coverage_proxy": 0.2
    },
    {
      "aligned_length": 54,
      "caid3_id": "DP04145",
      "identity": 0.37037,
      "matches": 20,
      "query_id": "DP02787",
      "score": 50,
      "shorter_sequence_coverage_proxy": 0.2
    },
    {
      "aligned_length": 57,
      "caid3_id": "DP04156",
      "identity": 0.36842,
      "matches": 21,
      "query_id": "DP02950",
      "score": 55,
      "shorter_sequence_coverage_proxy": 0.72152
    },
    {
      "aligned_length": 66,
      "caid3_id": "DP04066",
      "identity": 0.36364,
      "matches": 24,
      "query_id": "DP02593",
      "score": 53,
      "shorter_sequence_coverage_proxy": 0.22148
    },
    {
      "aligned_length": 62,
      "caid3_id": "DP04256",
      "identity": 0.35484,
      "matches": 22,
      "query_id": "DP02965",
      "score": 44,
      "shorter_sequence_coverage_proxy": 0.35227
    },
    {
      "aligned_length": 51,
      "caid3_id": "DP04072",
      "identity": 0.35294,
      "matches": 18,
      "query_id": "DP02704",
      "score": 30,
      "shorter_sequence_coverage_proxy": 0.28333
    },
    {
      "aligned_length": 51,
      "caid3_id": "DP04144",
      "identity": 0.35294,
      "matches": 18,
      "query_id": "DP02925",
      "score": 53,
      "shorter_sequence_coverage_proxy": 0.12114
    },
    {
      "aligned_length": 57,
      "caid3_id": "DP04381",
      "identity": 0.35088,
      "matches": 20,
      "query_id": "DP02592",
      "score": 37,
      "shorter_sequence_coverage_proxy": 0.38776
    },
    {
      "aligned_length": 58,
      "caid3_id": "DP04072",
      "identity": 0.34483,
      "matches": 20,
      "query_id": "DP02925",
      "score": 59,
      "shorter_sequence_coverage_proxy": 0.32222
    },
    {
      "aligned_length": 58,
      "caid3_id": "DP04379",
      "identity": 0.34483,
      "matches": 20,
      "query_id": "DP02964",
      "score": 37,
      "shorter_sequence_coverage_proxy": 0.16338
    },
    {
      "aligned_length": 209,
      "caid3_id": "DP04284",
      "identity": 0.3445,
      "matches": 72,
      "query_id": "DP02635",
      "score": 275,
      "shorter_sequence_coverage_proxy": 0.69205
    },
    {
      "aligned_length": 67,
      "caid3_id": "DP04198",
      "identity": 0.34328,
      "matches": 23,
      "query_id": "DP02853",
      "score": 42,
      "shorter_sequence_coverage_proxy": 0.31754
    },
    {
      "aligned_length": 73,
      "caid3_id": "DP04087",
      "identity": 0.34247,
      "matches": 25,
      "query_id": "DP02373",
      "score": 52,
      "shorter_sequence_coverage_proxy": 0.26165
    },
    {
      "aligned_length": 53,
      "caid3_id": "DP04257",
      "identity": 0.33962,
      "matches": 18,
      "query_id": "DP02950",
      "score": 32,
      "shorter_sequence_coverage_proxy": 0.67089
    },
    {
      "aligned_length": 56,
      "caid3_id": "DP03804",
      "identity": 0.33929,
      "matches": 19,
      "query_id": "DP02592",
      "score": 48,
      "shorter_sequence_coverage_proxy": 0.12389
    },
    {
      "aligned_length": 56,
      "caid3_id": "DP04158",
      "identity": 0.33929,
      "matches": 19,
      "query_id": "DP02726",
      "score": 39,
      "shorter_sequence_coverage_proxy": 0.11155
    },
    {
      "aligned_length": 68,
      "caid3_id": "DP04198",
      "identity": 0.33824,
      "matches": 23,
      "query_id": "DP02722",
      "score": 56,
      "shorter_sequence_coverage_proxy": 0.02818
    },
    {
      "aligned_length": 102,
      "caid3_id": "DP04384",
      "identity": 0.33333,
      "matches": 34,
      "query_id": "DP02605",
      "score": 82,
      "shorter_sequence_coverage_proxy": 0.2161
    },
    {
      "aligned_length": 90,
      "caid3_id": "DP04219",
      "identity": 0.33333,
      "matches": 30,
      "query_id": "DP02925",
      "score": 52,
      "shorter_sequence_coverage_proxy": 0.26627
    },
    {
      "aligned_length": 87,
      "caid3_id": "DP04096",
      "identity": 0.33333,
      "matches": 29,
      "query_id": "DP02605",
      "score": 101,
      "shorter_sequence_coverage_proxy": 0.18432
    },
    {
      "aligned_length": 63,
      "caid3_id": "DP04392",
      "identity": 0.33333,
      "matches": 21,
      "query_id": "DP03027",
      "score": 44,
      "shorter_sequence_coverage_proxy": 0.15291
    },
    {
      "aligned_length": 51,
      "caid3_id": "DP04384",
      "identity": 0.33333,
      "matches": 17,
      "query_id": "DP02730",
      "score": 50,
      "shorter_sequence_coverage_proxy": 0.05
    },
    {
      "aligned_length": 51,
      "caid3_id": "DP03824",
      "identity": 0.33333,
      "matches": 17,
      "query_id": "DP02808",
      "score": 42,
      "shorter_sequence_coverage_proxy": 0.23182
    },
    {
      "aligned_length": 51,
      "caid3_id": "DP03804",
      "identity": 0.33333,
      "matches": 17,
      "query_id": "DP02950",
      "score": 40,
      "shorter_sequence_coverage_proxy": 0.64557
    },
    {
      "aligned_length": 100,
      "caid3_id": "DP04373",
      "identity": 0.33,
      "matches": 33,
      "query_id": "DP02373",
      "score": 66,
      "shorter_sequence_coverage_proxy": 0.35842
    },
    {
      "aligned_length": 100,
      "caid3_id": "DP04379",
      "identity": 0.33,
      "matches": 33,
      "query_id": "DP02722",
      "score": 76,
      "shorter_sequence_coverage_proxy": 0.21552
    },
    {
      "aligned_length": 61,
      "caid3_id": "DP04256",
      "identity": 0.32787,
      "matches": 20,
      "query_id": "DP02664",
      "score": 38,
      "shorter_sequence_coverage_proxy": 0.34659
    },
    {
      "aligned_length": 58,
      "caid3_id": "DP04096",
      "identity": 0.32759,
      "matches": 19,
      "query_id": "DP02716",
      "score": 43,
      "shorter_sequence_coverage_proxy": 0.22745
    },
    {
      "aligned_length": 55,
      "caid3_id": "DP04219",
      "identity": 0.32727,
      "matches": 18,
      "query_id": "DP02704",
      "score": 51,
      "shorter_sequence_coverage_proxy": 0.16272
    },
    {
      "aligned_length": 55,
      "caid3_id": "DP04373",
      "identity": 0.32727,
      "matches": 18,
      "query_id": "DP03345",
      "score": 43,
      "shorter_sequence_coverage_proxy": 0.1735
    },
    {
      "aligned_length": 52,
      "caid3_id": "DP04166",
      "identity": 0.32692,
      "matches": 17,
      "query_id": "DP02635",
      "score": 53,
      "shorter_sequence_coverage_proxy": 0.10484
    },
    {
      "aligned_length": 52,
      "caid3_id": "DP03995",
      "identity": 0.32692,
      "matches": 17,
      "query_id": "DP02726",
      "score": 34,
      "shorter_sequence_coverage_proxy": 0.16561
    },
    {
      "aligned_length": 77,
      "caid3_id": "DP04257",
      "identity": 0.32468,
      "matches": 25,
      "query_id": "DP02371",
      "score": 71,
      "shorter_sequence_coverage_proxy": 0.30196
    },
    {
      "aligned_length": 77,
      "caid3_id": "DP04166",
      "identity": 0.32468,
      "matches": 25,
      "query_id": "DP02373",
      "score": 44,
      "shorter_sequence_coverage_proxy": 0.27599
    },
    {
      "aligned_length": 77,
      "caid3_id": "DP04087",
      "identity": 0.32468,
      "matches": 25,
      "query_id": "DP02622",
      "score": 64,
      "shorter_sequence_coverage_proxy": 0.17149
    },
    {
      "aligned_length": 108,
      "caid3_id": "DP04156",
      "identity": 0.32407,
      "matches": 35,
      "query_id": "DP02869",
      "score": 94,
      "shorter_sequence_coverage_proxy": 0.19601
    },
    {
      "aligned_length": 68,
      "caid3_id": "DP04392",
      "identity": 0.32353,
      "matches": 22,
      "query_id": "DP02521",
      "score": 62,
      "shorter_sequence_coverage_proxy": 0.11909
    },
    {
      "aligned_length": 62,
      "caid3_id": "DP04051",
      "identity": 0.32258,
      "matches": 20,
      "query_id": "DP02712",
      "score": 55,
      "shorter_sequence_coverage_proxy": 0.11742
    },
    {
      "aligned_length": 59,
      "caid3_id": "DP04373",
      "identity": 0.32203,
      "matches": 19,
      "query_id": "DP02661",
      "score": 43,
      "shorter_sequence_coverage_proxy": 0.1385
    },
    {
      "aligned_length": 56,
      "caid3_id": "DP04219",
      "identity": 0.32143,
      "matches": 18,
      "query_id": "DP02414",
      "score": 41,
      "shorter_sequence_coverage_proxy": 0.18605
    },
    {
      "aligned_length": 56,
      "caid3_id": "DP03824",
      "identity": 0.32143,
      "matches": 18,
      "query_id": "DP03338",
      "score": 51,
      "shorter_sequence_coverage_proxy": 0.31638
    },
    {
      "aligned_length": 53,
      "caid3_id": "DP03824",
      "identity": 0.32075,
      "matches": 17,
      "query_id": "DP02640",
      "score": 43,
      "shorter_sequence_coverage_proxy": 0.0987
    },
    {
      "aligned_length": 50,
      "caid3_id": "DP04384",
      "identity": 0.32,
      "matches": 16,
      "query_id": "DP02591",
      "score": 42,
      "shorter_sequence_coverage_proxy": 0.07267
    },
    {
      "aligned_length": 50,
      "caid3_id": "DP04381",
      "identity": 0.32,
      "matches": 16,
      "query_id": "DP02593",
      "score": 33,
      "shorter_sequence_coverage_proxy": 0.34014
    },
    {
      "aligned_length": 50,